,Product Title,Product Price,Product Rating,Product Image URL
0,No title found,No price found,No rating found,https://m.media-amazon.com/images/G/01/Amazon_Music_Merch/2024_Campaigns/Sparkles/030824_USEN_ArtistMerch_Sparkle_D_LukeBryan_2000x200.jpg
1,No title found,No price found,No rating found,No image found
2,"Amazon Essentials Women's Classic-Fit Short-Sleeve V-Neck T-Shirt, Multipacks",$19.00,4.4 out of 5 stars,https://m.media-amazon.com/images/I/61VXOrqsTyS._AC_UL320_.jpg
3,BINTEHGS Oversized Grunge Vintage t Shirts for Women Short Sleeve Cotton Casual Baggy Tees Teens Trendy Crew Neck Loose Tops,$19.79,4.3 out of 5 stars,https://m.media-amazon.com/images/I/710qfP6fPyL._AC_UL320_.jpg
4,"Champion Men'S Tshirt, Classic Graphic Tshirt Soft And Comfortable T-Shirts For Men, Script Logo Reg. Or Big & Tall",$11.25,4.6 out of 5 stars,https://m.media-amazon.com/images/I/51xz0O7su-L._AC_UL320_.jpg
5,"Champion Men'S Sleeveless T-Shirt, Sport Muscle Tank, Moisture Wicking, Muscle T-Shirt For Men (Reg. Or Big & Tall)",$15.00,4.5 out of 5 stars,https://m.media-amazon.com/images/I/71d4iBfee5L._AC_UL320_.jpg
6,"Gildan Men's Crew T-Shirts, Multipack, Style G1100",$25.33,4.6 out of 5 stars,https://m.media-amazon.com/images/I/51wDsZxtTLL._AC_UL320_.jpg
7,"Hanes Men's Pocket Undershirt Pack, Cotton Crew Neck T-Shirt, Moisture Wicking Tee, Assorted 6-Pack",$21.98,4.4 out of 5 stars,https://m.media-amazon.com/images/I/61NxWlAdrpL._AC_UL320_.jpg
8,"Hanes Men's T-Shirt, Beefy-T Heavyweight Cotton Crewneck Tee, 1 or 2 Pack, Available in Tall Sizes",No price found,4.5 out of 5 stars,https://m.media-amazon.com/images/I/71zRMNf2uvL._AC_UL320_.jpg
9,Fruit of the Loom Men's Eversoft Cotton Stay Tucked Crew T-Shirt,$21.49,4.6 out of 5 stars,https://m.media-amazon.com/images/I/51OijIFUO9L._AC_UL320_.jpg
10,"Hanes Mens Essentials T-Shirt Pack, Crewneck Cotton T-Shirts For Men, 4 Or 6 Pack Available",$19.55,4.4 out of 5 stars,https://m.media-amazon.com/images/I/612OCczgZHL._AC_UL320_.jpg
11,"Russell Athletic Men's Dri-Power Cotton Blend Short Sleeve Tees, Moisture Wicking, Odor Protection, UPF 30+, Sizes S-4x",$6.82,4.5 out of 5 stars,https://m.media-amazon.com/images/I/71F4P1t80EL._AC_UL320_.jpg
12,Amazon Essentials Women's Classic-Fit Long-Sleeve Crewneck T-Shirt (Available in Plus Size),$17.10,4.4 out of 5 stars,https://m.media-amazon.com/images/I/8134JMYp-5L._AC_UL320_.jpg
13,Kingsted T-Shirts for Men Pack - Royally Comfortable - Super Soft Premium Fabric - Well-Crafted Classic Tee,$39.87,4.3 out of 5 stars,https://m.media-amazon.com/images/I/71h0yd2XPML._AC_UL320_.jpg
14,"Champion Men'S Tshirt, Sport Tee, Moisture Wicking, Anti Odor, Athletic T-Shirt For Men Reg. Or Big & Tall",$25.00,4.5 out of 5 stars,https://m.media-amazon.com/images/I/51UYDsogA0L._AC_UL320_.jpg
15,Zeagoo Womens T Shirts Long Sleeve V Neck Basic Tee Soft Casual Loose Fit Fall Tops Outfits 2024,$32.99,4.5 out of 5 stars,https://m.media-amazon.com/images/I/71CQWy6fW6L._AC_UL320_.jpg
16,"Gildan Unisex-Adult Ultra Cotton T-Shirt, Style G2000, Multipack",$11.81,4.5 out of 5 stars,https://m.media-amazon.com/images/I/614rbIVRUJL._AC_UL320_.jpg
17,"Gildan Unisex-Adult Softstyle Cotton T-Shirt, Style G64000, Multipack",$18.33,4.5 out of 5 stars,https://m.media-amazon.com/images/I/71iXdORykrL._AC_UL320_.jpg
18,"Champion Men'S Tshirt, Classic Graphic Tshirt Soft And Comfortable T-Shirts For Men, Script Logo Reg. Or Big & Tall",$9.99,4.6 out of 5 stars,https://m.media-amazon.com/images/I/61ECvCbRZeL._AC_UL320_.jpg
19,"Comfort Colors Adult Short Sleeve Tee, Style 1717",$10.82,4.6 out of 5 stars,https://m.media-amazon.com/images/I/71NIMYE7NVL._AC_UL320_.jpg
20,Tankaneo Womens Short Sleeve Cropped T-Shirts Summer Rolled Dolman Sleeve Crop Tops Casual Round Neck Solid Short Basic Tees,$19.99,4.4 out of 5 stars,https://m.media-amazon.com/images/I/61NhHz5rG3L._AC_UL320_.jpg
21,EADINVE Womens V Neck 3/4 Sleeve T Shirts Casual Basic Summer Tees Shirts Loose Fit Tunic Tops Fall Pullover,$19.98,4.2 out of 5 stars,https://m.media-amazon.com/images/I/61lKSg+XqiL._AC_UL320_.jpg
22,Womens Tops Crewneck Raglan Summer T Shirts Casual Short Sleeve Side Split Tee Shirts,$14.99,4.3 out of 5 stars,https://m.media-amazon.com/images/I/71UpiBgOSwL._AC_UL320_.jpg
23,Satankud Men's Casual Henley Shirts Short Sleeve Summer Button T-Shirt Regular fit Undershirt,$19.99,4.3 out of 5 stars,https://m.media-amazon.com/images/I/71+rdIGz37L._AC_UL320_.jpg
24,"Fruit of the Loom Men's Eversoft Cotton T Shirts, Breathable & Moisture Wicking with Odor Control, Sizes S-4x",$16.40,4.5 out of 5 stars,https://m.media-amazon.com/images/I/71CtspAOaEL._AC_UL320_.jpg
25,"Amazon Essentials Women's Classic-Fit Short-Sleeve V-Neck T-Shirt, Multipacks",$19.00,4.4 out of 5 stars,https://m.media-amazon.com/images/I/91DjfbiLpRL._AC_UL320_.jpg
26,"Hanes Men's Heavyweight Pocket T-Shirt, Beefy-T Full-Cut Cotton Pocket Tee for Men, Crewneck T-Shirt For Men, 1 or 2 Pack",$10.65,4.5 out of 5 stars,https://m.media-amazon.com/images/I/81m+pQS6wjL._AC_UL320_.jpg
27,Hanes Women's Perfect-T Short Sleeve Cotton Crewneck T-Shirt,$7.75,4.2 out of 5 stars,https://m.media-amazon.com/images/I/71M9peTkd3L._AC_UL320_.jpg
28,MCPORO Workout Shirts for Men Short Sleeve Quick Dry Athletic Gym Active T Shirt Moisture Wicking,$43.99,4.4 out of 5 stars,https://m.media-amazon.com/images/I/81h2yu7SFML._AC_UL320_.jpg
29,"Hanes Men's Cotton, Moisture-Wicking Crew Tee Undershirts, Multi-Packs Available",$15.40,4.5 out of 5 stars,https://m.media-amazon.com/images/I/71ueRA6JRFL._AC_UL320_.jpg
30,AUTOMET T Shirts Short Sleeve V Neck Tees for Women Fashion Tops Trendy Lightweight Soft Casual Summer Outfits Clothes 2024,$13.96,4.4 out of 5 stars,https://m.media-amazon.com/images/I/71LDQ3TRGEL._AC_UL320_.jpg
31,"Champion Men'S Muscle T-Shirt, Sleeveless, Muscle Tank, Classic Muscle Tee Top For Men (Reg. Or Big & Tall)",$15.99,4.5 out of 5 stars,https://m.media-amazon.com/images/I/81tLDd0lmzL._AC_UL320_.jpg
32,"Champion Men'S Muscle T-Shirt, Sleeveless, Muscle Tank, Classic Muscle Tee Top For Men (Reg. Or Big & Tall)",$15.99,4.5 out of 5 stars,https://m.media-amazon.com/images/I/81tLDd0lmzL._AC_UL320_.jpg
33,"Champion Men'S Tshirt, Classic Graphic Tshirt Soft And Comfortable T-Shirts For Men, Script Logo Reg. Or Big & Tall",$11.25,4.6 out of 5 stars,https://m.media-amazon.com/images/I/51xz0O7su-L._AC_UL320_.jpg
34,"Gildan Men's V-Neck T-Shirts, Multipack, Style G1103",$19.97,4.5 out of 5 stars,https://m.media-amazon.com/images/I/712iPqGUc4L._AC_UL320_.jpg
35,"Champion Men'S Classic T-Shirt, Everyday Tee For Men, Comfortable Soft Men'S T-Shirt (Reg. Or Big & Tall)",$15.00,4.5 out of 5 stars,https://m.media-amazon.com/images/I/81PqX7YyLBL._AC_UL320_.jpg
36,Lucky Brand Mens Venice Burnout Notch Neck Tee,$23.50,4.5 out of 5 stars,https://m.media-amazon.com/images/I/81RBJOLN-XL._AC_UL320_.jpg
37,Fisoew Womens Oversized Tees Loose T Shirts Half Sleeve Crew Neck Color Block Cotton Tunic Tops,$19.99,4.2 out of 5 stars,https://m.media-amazon.com/images/I/51QsdYsz3nS._AC_UL320_.jpg
38,No title found,No price found,No rating found,No image found
39,"Amazon Essentials Women's Tech Stretch Short-Sleeve Crewneck T-Shirt (Available in Plus Size), Multipacks",$8.90,4.4 out of 5 stars,https://m.media-amazon.com/images/I/91-a5MiJzxL._AC_UL320_.jpg
40,Fruit of the Loom Men's Eversoft Cotton Stay Tucked V-Neck T-Shirt,$17.48,4.6 out of 5 stars,https://m.media-amazon.com/images/I/51sc3-LB+hL._AC_UL320_.jpg
41,"Gildan Men's V-Neck T-Shirts, Multipack, Style G1103",$18.97,4.5 out of 5 stars,https://m.media-amazon.com/images/I/61P+otNOSvL._AC_UL320_.jpg
42,"Hanes Men's Essentials Short Sleeve T-shirt Value Pack (4-pack),black,4X-Large",$19.55,4.5 out of 5 stars,https://m.media-amazon.com/images/I/612OCczgZHL._AC_UL320_.jpg
43,INTO THE AM Mens T Shirt - Short Sleeve Crew Neck Soft Fitted Tees S - 4XL Fresh Classic Tshirts,$24.95,4.3 out of 5 stars,https://m.media-amazon.com/images/I/619zcvK1pdS._AC_UL320_.jpg
44,Real Essentials 5 Pack: Men’s Short Sleeve Dry Fit Active Crew Neck T Shirt - Athletic Running Gym Workout Tee Tops,$29.74,4.3 out of 5 stars,https://m.media-amazon.com/images/I/71LPdu26vxL._AC_UL320_.jpg
45,Hanes mens Originals Lightweight Tri-Blend Crewneck T-Shirts,$7.99,4.2 out of 5 stars,https://m.media-amazon.com/images/I/812k8naq1iL._AC_UL320_.jpg
46,"Gildan Unisex-Adult Heavy Cotton T-Shirt, Style G5000, Multipack",$34.99,4.5 out of 5 stars,https://m.media-amazon.com/images/I/61lDolpjTRL._AC_UL320_.jpg
47,ATHMILE Womens Oversized T Shirts Loose Fit Crewneck Short Sleeve Tops Summer Casual Blouse Y2K 2024 Basic Tee,$11.99,4.3 out of 5 stars,https://m.media-amazon.com/images/I/71XGWztM8EL._AC_UL320_.jpg
48,Pro Club Men's 3-Pack Heavyweight Cotton Short Sleeve Crew Neck T-Shirt,$22.85,4.6 out of 5 stars,https://m.media-amazon.com/images/I/7165KZveJ2L._AC_UL320_.jpg
49,"Hanes Men's Moisture-Wicking Crewneck Performance Undershirt, 5-Pack",$25.00,4.6 out of 5 stars,https://m.media-amazon.com/images/I/41Aa0y5f0sL._AC_UL320_.jpg
