,Product Title,Product Price,Product Rating,Product Image URL
0,No title found,No price found,No rating found,No image found
1,"Smart Watch, Fitness Tracker with Heart Rate, SpO2 and Sleep Monitor, 44mm Swimming Waterproof Watch, Fitness Watches for Women Men, Step Tracker, Smartwatch Compatible with iOS Android Phones",$19.99,4.1 out of 5 stars,https://m.media-amazon.com/images/I/61BLM8tEYOL._AC_UL320_.jpg
2,"ASWEE Smart Watch (Answer/Dial Call),Fitness Tracker with 1.85"" TFT Display,Multiple Sport Modes Smartwatch with Heart Rate Blood Oxygen and Sleep Monitor,IP68 Waterproof Smart Watches for Men Women",$16.99,4.1 out of 5 stars,https://m.media-amazon.com/images/I/61H-IizEiWL._AC_UL320_.jpg
3,"Smart Watch for Android iPhone [49mm], Bluetooth Call, 120+ Sports Modes Fitness Tracker, Heart Rate/Health/Sleep Monitor, Step Calorie Counter, Water Resistant Smartwatch for Women Men (Starlight)",$29.99,4.1 out of 5 stars,https://m.media-amazon.com/images/I/712GTVxvsVL._AC_UL320_.jpg
4,"GRV Smart Watch for iOS and Android Phones (Answer/Make Calls), Watches for Men Women IP68 Waterproof Smartwatch Fitness Tracker Watch with Heart Rate/Sleep Monitor Steps Calories Counter (Black)",$23.99,4.0 out of 5 stars,https://m.media-amazon.com/images/I/61kKbv4WA3L._AC_UL320_.jpg
5,Casio Men's Vintage F91W-1 Resin Strap Digital Sport Watch,$16.86,4.6 out of 5 stars,https://m.media-amazon.com/images/I/51Nk5SEBARL._AC_UL320_.jpg
6,Casio Men's MQ24-7B2 Analog Black Resin Strap Watch,$15.48,4.4 out of 5 stars,https://m.media-amazon.com/images/I/516s1Ljzp6L._AC_UL320_.jpg
7,NUOVO Women Watch Silicone Watch for Ladies Sports Watch Casual Watch Crystal Accented Leather Strap Watch Analog Display Watch,$9.99,4.4 out of 5 stars,https://m.media-amazon.com/images/I/61xU5wciA9L._AC_UL320_.jpg
8,"Smart Watch, Fitness Tracker with Heart Rate Monitor, Blood Oxygen, Sleep Tracking, 1.5 Inch Touchscreen Smartwatch for Android iOS Swimming Waterproof Pedometer Step Calories Tracker for Women Men",$19.99,4.0 out of 5 stars,https://m.media-amazon.com/images/I/61I22cL7v+L._AC_UL320_.jpg
9,"Casio F108WH Series | Men's Digital Watch | Illuminator | Water Resistant | LED Light | Daily Alarm | 1/100 SEC Stopwatch | 3 Hands (HR, Min, SEC) | Date/Day Display | Daily Alarm | 7 Year Battery",$16.88,4.6 out of 5 stars,https://m.media-amazon.com/images/I/510T962DtNL._AC_UL320_.jpg
10,Timex Men's Expedition Scout 40mm Watch,$48.75,4.4 out of 5 stars,https://m.media-amazon.com/images/I/91APJ9+qs2L._AC_UL320_.jpg
11,"SKG Smart Watch for Men Women Android iPhone, with Alexa Built-in & Bluetooth Call(Answer/Make Call) 1.69"" Fitness Tracker with IP68 Waterproof, 60+ Sports, Heart Rate SpO2 Monitor, V7 Pro",$79.59,4.0 out of 5 stars,https://m.media-amazon.com/images/I/61Hol-COwgL._AC_UL320_.jpg
12,"ENGERWALL Fitness Tracker with Step Counter/Calories/Stopwatch, Activity Tracker with Heart Rate Monitor, IP68, Health Tracker with Sleep Tracker, Smartwatch, Pedometer Watch for Women Men Kids",$20.99,3.7 out of 5 stars,https://m.media-amazon.com/images/I/61YvYiLUxDS._AC_UL320_.jpg
13,Ultra-Thin Minimalist Sports Waterproof Digital Watches Men with Wide-Angle Display Rubber Strap Wrist Watch for Men,$14.39,3.7 out of 5 stars,https://m.media-amazon.com/images/I/61wwbRCkCSL._AC_UL320_.jpg
14,XCZAP Outdoor Sport Watches Alarm Clock 5Bar Waterproof LED Digital Watch,$17.99,4.3 out of 5 stars,https://m.media-amazon.com/images/I/61MSlRkI3sL._AC_UL320_.jpg
15,Casio Illuminator AE1500WH Series | 10-Year Battery | LED Backlight | 5-Alarms | 1/100 Sec Stopwatch | Men's Digital Watch,$21.92,4.6 out of 5 stars,https://m.media-amazon.com/images/I/618sFNQTZYL._AC_UL320_.jpg
16,"LYMFHCH Men's Digital Watch, Sports Waterproof Military Watches for Men LED Casual Stopwatch Alarm Tactical Army Watch",$15.45,4.5 out of 5 stars,https://m.media-amazon.com/images/I/61AepCrYDOL._AC_UL320_.jpg
17,Armitron Sport Women's 45/7012PRSV Purple and Silver-Tone Digital Watch,$18.00,4.2 out of 5 stars,https://m.media-amazon.com/images/I/71j0nFQ4NqL._AC_UL320_.jpg
18,"Fitness Tracker Watch with Heart Rate Monitor, Activity Tracker with Pedometer, Sleep Monitor, Calories & Step Counter, 5ATM Waterproof Smart Watch for Women Men Health Fitness Watch for Sports",$19.99,3.9 out of 5 stars,https://m.media-amazon.com/images/I/7120xfZ5PGL._AC_UL320_.jpg
19,"IOWODO Smart Watch for Men Women - 1.85''HD Screen with Make and Answer Calls, with AI Voice Assistant, SpO2/Heart Rate/Sleep Monitor, 100+ Sports Modes, Smartwatch for Android and iOS (2 Straps)",$28.57,4.3 out of 5 stars,https://m.media-amazon.com/images/I/71oaX1N6STL._AC_UL320_.jpg
